{
  "apps": [
    {
      "id": "notes-lite",
      "name": "Notes Lite",
      "status": "enabled",
      "activeInstallId": "install_notes_lite_1",
      "activeVersion": "1.0.0",
      "dataVersion": 1,
      "createdAt": "2026-05-28T00:00:00Z",
      "updatedAt": "2026-05-28T00:00:00Z"
    }
  ],
  "appVersions": [
    {
      "installId": "install_notes_lite_1",
      "appId": "notes-lite",
      "version": "1.0.0",
      "runtimeVersion": "0.4.0",
      "dataVersion": 1,
      "manifest": {
        "id": "notes-lite",
        "version": "1.0.0"
      },
      "manifestHash": "sha256:manifest",
      "contentHash": "sha256:content",
      "signature": null,
      "trustLevel": "bundled",
      "status": "enabled",
      "createdAt": "2026-05-28T00:00:00Z",
      "activatedAt": "2026-05-28T00:00:00Z"
    }
  ],
  "appFiles": [
    {
      "installId": "install_notes_lite_1",
      "path": "index.html",
      "contentText": "<main></main>",
      "contentHash": "sha256:index",
      "sizeBytes": 13,
      "mime": "text/html",
      "createdAt": "2026-05-28T00:00:00Z"
    }
  ],
  "appPermissions": [
    {
      "installId": "install_notes_lite_1",
      "appId": "notes-lite",
      "permission": "storage.read",
      "requested": true,
      "approved": true,
      "approvedAt": "2026-05-28T00:00:00Z",
      "reason": "bundled app"
    }
  ],
  "appInstallations": [
    {
      "installationEventId": "install_event_1",
      "appId": "notes-lite",
      "installId": "install_notes_lite_1",
      "action": "install",
      "previousInstallId": null,
      "actor": "system",
      "reportId": "report_1",
      "createdAt": "2026-05-28T00:00:00Z",
      "details": {}
    }
  ],
  "appStorage": [
    {
      "appId": "notes-lite",
      "key": "notes-lite:notes",
      "value": [],
      "updatedAt": "2026-05-28T00:00:00Z"
    }
  ],
  "appMigrations": [],
  "appInstallReports": [
    {
      "reportId": "report_1",
      "appId": "notes-lite",
      "installId": "install_notes_lite_1",
      "status": "accepted",
      "validation": {
        "ok": true
      },
      "security": {
        "ok": true
      },
      "permissions": {
        "approved": [
          "storage.read"
        ]
      },
      "compatibility": {
        "ok": true
      },
      "smokeTest": {
        "ok": true
      },
      "contentHash": "sha256:content",
      "createdAt": "2026-05-28T00:00:00Z"
    }
  ]
}
